racedate,racetime,track,race_name,race_restrictions_age,race_class,major,race_distance,prize_money,going_description,number_of_runners,place,distbt,horse_name,stall,trainer,horse_age,jockey_name,jockeys_claim,pounds,odds,fav,official_rating,comptime,comptime_numeric,TotalDstBt,MedianOR,Dist_Furlongs,placing_numerical,RCode,BFSP,BFSP_Place,PlcsPaid,BFPlcsPaid,Yards,RailMove,RaceType,Comment,CardNo,StallPositioning,TrackDirection,Headgear,dayssincelr,careerruns,stallion,surfacetype,horse_prizewin,HorseSex,dam,damstallion,MaxORinRace,
"2023-10-30","12:30:00","Galway","Irish Stallion Farms EBF Fillies Maiden","2yo","Irish",,"1m.5f ","8496","Heavy","11","1st",,"Everlasting (IRE)","3","OBrien, A P","2","Heffernan, J A","0","128","4.5",,"0","1 mins 55.20s","115.2",,"0","8.5","1","Flat","0","0","3","0","1833","0","Maiden","soon led, pushed along over 1f out, soon ridden and asserted over 100 yards out, kept on well","3","None","Right Handed",,"18","1","Kingman","Undulating","8496","Filly","Could It Be Love (USA)","War Front (USA)","92",
"2023-10-30","12:30:00","Galway","Irish Stallion Farms EBF Fillies Maiden","2yo","Irish",,"1m.5f ","8496","Heavy","11","2nd","1.75","Kisiyra (IRE)","13","Murtagh, J P","2","Coen, Ben M","0","128","20",,"0","1 mins 55.20s","115.2","1.75","0","8.5","2","Flat","0","0","3","0","1833","0","Maiden","led early, tracked leader and 2nd halfway, ridden entering straight and no impression on winner inside final 150 yards, kept on one pace","6","None","Right Handed",,"13","2","Sea The Moon (GER)","Undulating","2832","Filly","Kisanga (IRE)","Redoutes Choice (AUS)","92",
"2023-10-30","12:30:00","Galway","Irish Stallion Farms EBF Fillies Maiden","2yo","Irish",,"1m.5f ","8496","Heavy","11","3rd","1.75","Rubies Are Red (IRE)","6","OBrien, A P","2","Carroll, G F","0","128","10",,"0","1 mins 55.20s","115.2","3.5","0","8.5","3","Flat","0","0","3","0","1833","0","Maiden","mid-division, 7th halfway, some headway entering straight, 5th and switched right 1f out, kept on well on inner to go 3rd close home","9","None","Right Handed",,"None","0","Galileo (IRE)","Undulating","1416","Filly","Red Evie (IRE)","Intikhab (USA)","92",
"2023-10-30","12:30:00","Galway","Irish Stallion Farms EBF Fillies Maiden","2yo","Irish",,"1m.5f ","8496","Heavy","11","4th","0.5","Into The Groove (IRE)","9","OBrien, Joseph Patrick","2","Sheehy, M P","0","128","40",,"0","1 mins 55.20s","115.2","4","0","8.5","4","Flat","0","0","3","0","1833","0","Maiden","tracked leaders, 4th halfway, 3rd and pushed along entering straight, soon ridden and edged right, kept on one pace inside final furlong, dropped to 4th close home","4","None","Right Handed",,"34","1","Invincible Spirit (IRE)","Undulating","708","Filly","Sea Mona (USA)","Tiz Wonderful (USA)","92",
"2023-10-30","12:30:00","Galway","Irish Stallion Farms EBF Fillies Maiden","2yo","Irish",,"1m.5f ","8496","Heavy","11","5th","1.75","Lope De Lilas (IRE)","7","Mullins, W P","2","Keane, C T","0","128","1.5","(Fav)","0","1 mins 55.20s","115.2","5.75","0","8.5","5","Flat","0","0","3","0","1833","0","Maiden","rear of mid-division, 8th halfway, 7th and pushed along entering straight, kept on one pace to go 5th closing stages","7","None","Right Handed",,"None","0","Lope De Vega (IRE)","Undulating","425","Filly","Golden Gazelle (IRE)","Galileo (IRE)","92",
"2023-10-30","12:30:00","Galway","Irish Stallion Farms EBF Fillies Maiden","2yo","Irish",,"1m.5f ","8496","Heavy","11","6th","1.25","Settlement","11","Weld, D K","2","Hayes, C D","0","128","2.75",,"92","1 mins 55.20s","115.2","7","0","8.5","6","Flat","0","0","3","0","1833","0","Maiden","mid-division, 6th halfway, pushed along and headway on outer in 4th entering straight, ridden over 1f out and soon no impression, no extra final 100 yards","11","None","Right Handed",,"36","3","Kingman","Undulating","283","Filly","Tempera","Dansili","92",
"2023-10-30","12:30:00","Galway","Irish Stallion Farms EBF Fillies Maiden","2yo","Irish",,"1m.5f ","8496","Heavy","11","7th","4.25","Iseult Of Ireland (USA)","8","OBrien, A P","2","Lee, W J","0","128","7.5",,"0","1 mins 55.20s","115.2","11.25","0","8.5","7","Flat","0","0","3","0","1833","0","Maiden","towards rear, pushed along and no impression halfway, 10th and ridden entering straight, kept on one pace inside final furlong, never a factor","5","None","Right Handed",,"None","0","American Pharoah (USA)","Undulating","0","Filly","The Tooth Fairy",,"92",
"2023-10-30","12:30:00","Galway","Irish Stallion Farms EBF Fillies Maiden","2yo","Irish",,"1m.5f ","8496","Heavy","11","8th","0.5","Saxon Land (IRE)","1","Murphy, Ciaran","2","McAteer, L T","0","128","80",,"0","1 mins 55.20s","115.2","11.75","0","8.5","8","Flat","0","0","3","0","1833","0","Maiden","tracked leaders, 3rd halfway, pushed along approaching straight, 6th and ridden when hampered 1f out, no extra","10","None","Right Handed",,"18","2","Saxon Warrior (JPN)","Undulating","0","Filly","Turama","Pivotal","92",
"2023-10-30","12:30:00","Galway","Irish Stallion Farms EBF Fillies Maiden","2yo","Irish",,"1m.5f ","8496","Heavy","11","9th","2.5","Out For A Stroll (IRE)","4","OBrien, Joseph Patrick","2","Halpin, G P","0","128","50",,"0","1 mins 55.20s","115.2","14.25","0","8.5","9","Flat","0","0","3","0","1833","0","Maiden","towards rear and pushed along early, 9th halfway, pushed along again approaching straight and no impression final furlong, no extra","8","None","Right Handed",,"None","0","Churchill (IRE)","Undulating",,"Filly","In Her Stride (IRE)","Mastercraftsman (IRE)","92",
"2023-10-30","12:30:00","Galway","Irish Stallion Farms EBF Fillies Maiden","2yo","Irish",,"1m.5f ","8496","Heavy","11","10th","1.75","Codladh Samh (IRE)","2","Bolger, J S","2","Whelan, R P","0","128","25",,"0","1 mins 55.20s","115.2","16","0","8.5","10","Flat","0","0","3","0","1833","0","Maiden","slowly away, always towards rear, pushed along approaching straight and no impression over 1f out, no extra","2","None","Right Handed",,"None","0","Parish Hall (IRE)","Undulating",,"Filly","In Somno (IRE)","Dream Ahead (USA)","92",
"2023-10-30","12:30:00","Galway","Irish Stallion Farms EBF Fillies Maiden","2yo","Irish",,"1m.5f ","8496","Heavy","11","11th","27","Animous","12","Slattery, Andrew","2","Horgan, C","7","121","250",,"0","1 mins 55.20s","115.2","43","0","8.5","11","Flat","0","0","3","0","1833","0","Maiden","tracked leaders, 5th halfway, pushed along and lost place approaching straight, no extra in rear under 2f out, eased, tailed off","1","None","Right Handed",,"138","1","Le Brivido (FR)","Undulating",,"Filly","Miss You Too","Montjeu (IRE)","92",
"2023-10-30","13:05:00","Galway","KONE Handicap (50-80)","3yo+","Irish",,"1m.5f ","6372","Heavy","15","1st",,"San Aer (IRE)","7","Mullins, Thomas","5","Lee, W J","0","142","3","(JFav)","77","1 mins 53.60s","113.6",,"74","8.5","1","Flat","0","0","3","0","1833","0","Handicap","mid-division, headway travelling well between horses approaching straight, 4th over 1f out, squeezed through gap to lead over 100 yards out, kept on well","2","None","Right Handed"," TT","8","33","Vocalised (USA)","Undulating","6372","Gelding","Teacht An Earraig (USA)","Galileo (IRE)","79",
"2023-10-30","13:05:00","Galway","KONE Handicap (50-80)","3yo+","Irish",,"1m.5f ","6372","Heavy","15","2nd","3.25","Big Island (IRE)","3","Lanigan, W J","6","McCullagh, Scott","3","136","6",,"74","1 mins 53.60s","113.6","3.25","74","8.5","2","Flat","0","0","3","0","1833","0","Handicap","tracked leader, 2nd halfway, pushed along approaching straight and soon ridden, no impression on winner final 100 yards, kept on one pace","6","None","Right Handed",,"13","28","Canford Cliffs (IRE)","Undulating","2124","Gelding","Misty Lane (IRE)","Ad Valorem (USA)","79",
"2023-10-30","13:05:00","Galway","KONE Handicap (50-80)","3yo+","Irish",,"1m.5f ","6372","Heavy","15","3rd","0.5","Rough And Tough (IRE)","2","Mulvany, Michael","3","Joyce, Wesley","7","125","3","(JFav)","70","1 mins 53.60s","113.6","3.75","74","8.5","3","Flat","0","0","3","0","1833","0","Handicap","tracked leaders, 5th halfway, headway in 3rd entering straight, ridden and kept on one pace inside final furlong","14","None","Right Handed",,"13","13","Tough As Nails (IRE)","Undulating","1062","Gelding","Annagh Haven (IRE)","Indian Haven","79",
"2023-10-30","13:05:00","Galway","KONE Handicap (50-80)","3yo+","Irish",,"1m.5f ","6372","Heavy","15","4th","HD","Independent Expert (IRE)","12","Slattery, Andrew","4","Horgan, C","7","135","22",,"77","1 mins 53.60s","113.6","3.85","74","8.5","4","Flat","0","0","3","0","1833","0","Handicap","dwelt and towards rear, pushed along and headway on outer entering straight, ridden and went 5th 1f out, kept on well inside final 150 yards","1","None","Right Handed",,"29","24","Gutaifan (IRE)","Undulating","531","Filly","Distinguish (IRE)","Refuse To Bend (IRE)","79",
"2023-10-30","13:05:00","Galway","KONE Handicap (50-80)","3yo+","Irish",,"1m.5f ","6372","Heavy","15","5th","0.75","Not Just Yet (IRE)","6","Meade, Noel","3","Keane, C T","0","133","12",,"71","1 mins 53.60s","113.6","4.6","74","8.5","5","Flat","0","0","3","0","1833","0","Handicap","tracked leaders, headway to lead after 2f, ran freely, pushed along over 1f out, soon ridden and headed over 100 yards out, no extra","13","None","Right Handed",,"17","11","Night Of Thunder (IRE)","Undulating","319","Gelding","Nefetari","Kodiac","79",
"2023-10-30","13:05:00","Galway","KONE Handicap (50-80)","3yo+","Irish",,"1m.5f ","6372","Heavy","15","6th","1.75","You Owe Me Money (IRE)","9","Bunyan, Darren / OLeary, G","5","Curran, D N","7","134","18",,"76","1 mins 53.60s","113.6","6.35","74","8.5","6","Flat","0","0","3","0","1833","0","Handicap","towards rear, headway between horses approaching straight, 6th and ridden over 1f out, kept on one pace","4","None","Right Handed",,"26","22","Awtaad (IRE)","Undulating","212","Mare","Magie Noire (IRE)","Marju (IRE)","79",
"2023-10-30","13:05:00","Galway","KONE Handicap (50-80)","3yo+","Irish",,"1m.5f ","6372","Heavy","15","7th","2.5","Coins Cross (IRE)","1","Harty, Edward and Patrick","5","Roche, L F","0","139","28",,"74","1 mins 53.60s","113.6","8.85","74","8.5","7","Flat","0","0","3","0","1833","0","Handicap","pushed along early and soon led, headed after 2f and 3rd halfway, ridden and no impression approaching straight, no extra from over 1f out","7","None","Right Handed","Blnk","23","29","Dragon Pulse (IRE)","Undulating","0","Gelding","Miz Makfi","Makfi","79",
"2023-10-30","13:05:00","Galway","KONE Handicap (50-80)","3yo+","Irish",,"1m.5f ","6372","Heavy","15","8th","0.5","The Mpex Kid (IRE)","14","Murphy, Ciaran","7","Powell, J A","3","133","50",,"71","1 mins 53.60s","113.6","9.35","74","8.5","8","Flat","0","0","3","0","1833","0","Handicap","mid-division, some headway on outer into 6th halfway, ridden and no impression entering straight, no threat from over 1f out, kept on one pace","11","None","Right Handed",,"10","34","Tamayuz","Undulating","0","Gelding","Startarette (USA)","Dixieland Band (USA)","79",
"2023-10-30","13:05:00","Galway","KONE Handicap (50-80)","3yo+","Irish",,"1m.5f ","6372","Heavy","15","9th","NK","Rhythm King (IRE)","13","Fahey, Mark","3","Kearney, J","5","136","8",,"79","1 mins 53.60s","113.6","9.5","74","8.5","9","Flat","0","0","3","0","1833","0","Handicap","tracked leaders, 4th halfway, pushed along approaching straight, soon ridden and 7th 1f out, no extra","3","None","Right Handed",,"14","12","Elzaam (AUS)","Undulating",,"Gelding","Queen Of Rap (IRE)","Alhaarth (IRE)","79",
"2023-10-30","13:05:00","Galway","KONE Handicap (50-80)","3yo+","Irish",,"1m.5f ","6372","Heavy","15","10th","2.5","Wrist Art (IRE)","15","Doyle, Timothy","6","Hassett, M W","7","128","7",,"70","1 mins 53.60s","113.6","12","74","8.5","10","Flat","0","0","3","0","1833","0","Handicap","rear of mid-division on outer, pushed along and some headway entering straight, no impression inside final furlong","12","None","Right Handed",,"14","20","Sir Prancealot (IRE)","Undulating",,"Gelding","Vasoni (IRE)","Redback","79",
"2023-10-30","13:05:00","Galway","KONE Handicap (50-80)","3yo+","Irish",,"1m.5f ","6372","Heavy","15","11th","1.25","La Tulipe Noire (IRE)","4","Murphy, Ciaran","3","Coen, Ben M","0","138","40",,"76","1 mins 53.60s","113.6","13.25","74","8.5","11","Flat","0","0","3","0","1833","0","Handicap","mid-division, 7th halfway, pushed along approaching straight, no extra from over 1f out","8","None","Right Handed","Blnk","10","11","Berkshire (IRE)","Undulating",,"Filly","Ambermaryrose (IRE)","Cape Cross (IRE)","79",
"2023-10-30","13:05:00","Galway","KONE Handicap (50-80)","3yo+","Irish",,"1m.5f ","6372","Heavy","15","12th","NK","Rio Largo (IRE)","11","Comer, Luke","3","Hayes, C D","0","136","25",,"74","1 mins 53.60s","113.6","13.4","74","8.5","12","Flat","0","0","3","0","1833","0","Handicap","always towards rear, never a factor, pushed along and no impression approaching straight, kept on one pace final furlong","10","None","Right Handed",,"23","16","Dick Whittington (IRE)","Undulating",,"Colt","Reem Star","Green Tune (USA)","79",
"2023-10-30","13:05:00","Galway","KONE Handicap (50-80)","3yo+","Irish",,"1m.5f ","6372","Heavy","15","13th","1.25","Fools Glory (IRE)","8","McEnery, P F","4","MacRedmond, Cian","5","131","22",,"71","1 mins 53.60s","113.6","14.65","74","8.5","13","Flat","0","0","3","0","1833","0","Handicap","tracked leaders early, mid-division halfway, pushed along and no impression approaching straight, ridden and no extra over 1f out","9","None","Right Handed","CkPc TT","15","20","Cotai Glory","Undulating",,"Filly","Novel Fun (IRE)","Noverre (USA)","79",
"2023-10-30","13:05:00","Galway","KONE Handicap (50-80)","3yo+","Irish",,"1m.5f ","6372","Heavy","15","14th","1.25","Fleadhfest (IRE)","10","Bolger, J S","3","McCullagh, N G","0","119","100",,"57","1 mins 53.60s","113.6","15.9","74","8.5","14","Flat","0","0","3","0","1833","0","Handicap","always towards rear, never a factor, pushed along and no impression entering straight, no extra","15","None","Right Handed"," TT","13","8","Vocalised (USA)","Undulating",,"Filly","Flea Cheoil (IRE)","Galileo (IRE)","79",
"2023-10-30","13:05:00","Galway","KONE Handicap (50-80)","3yo+","Irish",,"1m.5f ","6372","Heavy","15","15th","6.5","Out On Friday (IRE)","5","Byrne, Philip Michael","7","Bowen, S D","5","135","40",,"75","1 mins 53.60s","113.6","22.4","74","8.5","15","Flat","0","0","3","0","1833","0","Handicap","pushed along early and soon rear of mid-division, towards rear halfway, pushed along again and no impression in rear approaching straight, no extra","5","None","Right Handed",,"8","59","Masterofthehorse (IRE)","Undulating",,"Gelding","Macsteps (IRE)","Footstepsinthesand","79",
"2023-10-30","13:40:00","Galway","www.swordsecurity.com Nursery Handicap","2yo","Irish",,"7f ","6106","Heavy","11","1st",,"Ive Been Dreaming (IRE)","1","Fahey, Mark","2","Whelan, R P","0","125","20",,"57","1 mins 37.26s","97.26",,"61","7","1","Flat","0","0","3","0","1540","0","Handicap Nursery","mid-division, 6th halfway, 4th and pushed along 2f out, ridden and headway between horses inside final furlong, led 70 yards out and kept on well","7","None","Right Handed",,"17","4","Belardo (IRE)","Undulating","6106","Colt","Burn The Breeze (IRE)","Beat Hollow","71",
"2023-10-30","13:40:00","Galway","www.swordsecurity.com Nursery Handicap","2yo","Irish",,"7f ","6106","Heavy","11","2nd","0.5","Victors Choice (IRE)","10","Murray, Adrian","2","Hassett, M W","7","118","40",,"57","1 mins 37.26s","97.26","0.5","61","7","2","Flat","0","0","3","0","1540","0","Handicap Nursery","rear of mid-division, pushed along and not clear run early straight, switched right and ridden in 8th 1f out, kept on well inside final furlong to go 2nd close home, nearest at finish","8","None","Right Handed",,"46","3","The Last Lion (IRE)","Undulating","2035","Filly","Northern Jewel (IRE)","Nayef (USA)","71",
"2023-10-30","13:40:00","Galway","www.swordsecurity.com Nursery Handicap","2yo","Irish",,"7f ","6106","Heavy","11","3rd","NK","Dolce Far Niente (IRE)","4","Murphy, Joseph G","2","Marshall, Tom Kiely","7","114","5",,"53","1 mins 37.26s","97.26","0.65","61","7","3","Flat","0","0","3","0","1540","0","Handicap Nursery","tracked leaders, ran freely, 3rd halfway, 2nd and pushed along 2f out, ridden and kept on well inside final furlong","9","None","Right Handed",,"13","4","Zoffany (IRE)","Undulating","1018","Filly","Lady Mona (IRE)","Tamayuz","71",
"2023-10-30","13:40:00","Galway","www.swordsecurity.com Nursery Handicap","2yo","Irish",,"7f ","6106","Heavy","11","4th","1.25","Apollo Prince (IRE)","8","Harty, Edward and Patrick","2","Hayes, C D","0","137","22",,"69","1 mins 37.26s","97.26","1.9","61","7","4","Flat","0","0","3","0","1540","0","Handicap Nursery","tracked leader, ran freely and led after 1 1/2f, went 3 lengths clear 2f out, ridden 1f out and headed 70 yards out, no extra","3","None","Right Handed","Blnk","46","3","Kodiac","Undulating","509","Colt","Tajbell (IRE)","New Approach (IRE)","71",
"2023-10-30","13:40:00","Galway","www.swordsecurity.com Nursery Handicap","2yo","Irish",,"7f ","6106","Heavy","11","5th","1.25","Guest Star","2","Bunyan, Darren / OLeary, G","2","Keane, C T","0","136","4",,"68","1 mins 37.26s","97.26","3.15","61","7","5","Flat","0","0","3","0","1540","0","Handicap Nursery","mid-division, 6th 2f out, pushed along and some headway entering straight, 4th and ridden early final furlong, kept on one pace","4","None","Right Handed","Blnk","13","8","Due Diligence (USA)","Undulating","305","Gelding","Livella Fella (IRE)","Strategic Prince","71",
"2023-10-30","13:40:00","Galway","www.swordsecurity.com Nursery Handicap","2yo","Irish",,"7f ","6106","Heavy","11","6th","1.25","Thia (IRE)","5","Bolger, J S","2","McCullagh, N G","0","129","6",,"61","1 mins 37.26s","97.26","4.4","61","7","6","Flat","0","0","3","0","1540","0","Handicap Nursery","tracked leaders, 4th and pushed along halfway, 5th and ridden 2f out, no impression final furlong, kept on one pace","6","None","Right Handed",,"13","6","Vocalised (USA)","Undulating","204","Gelding","Teoiriciuil (IRE)","Teofilo (IRE)","71",
"2023-10-30","13:40:00","Galway","www.swordsecurity.com Nursery Handicap","2yo","Irish",,"7f ","6106","Heavy","11","7th","0.75","Dont Do Dramas (IRE)","3","Mulvany, Michael","2","Lee, W J","0","132","2.5","(Fav)","64","1 mins 37.26s","97.26","5.15","61","7","7","Flat","0","0","3","0","1540","0","Handicap Nursery","led early, tracked leader and 2nd halfway, 3rd and ridden 2f out, no impression over 1f out, no extra inside final furlong","5","None","Right Handed",,"13","5","Le Havre (IRE)","Undulating","0","Gelding","Mutamarida (IRE)","Teofilo (IRE)","71",
"2023-10-30","13:40:00","Galway","www.swordsecurity.com Nursery Handicap","2yo","Irish",,"7f ","6106","Heavy","11","8th","NK","Barley Cove (IRE)","9","Lynam, Edward","2","Ryan, J J G","5","133","11",,"70","1 mins 37.26s","97.26","5.300000000000001","61","7","8","Flat","0","0","3","0","1540","0","Handicap Nursery","towards rear, pushed along and no impression approaching straight, kept on one pace on inner inside final furlong, never a factor","2","None","Right Handed",,"12","6","Footstepsinthesand","Undulating","0","Colt","Colomone Cross (IRE)","Xaar","71",
"2023-10-30","13:40:00","Galway","www.swordsecurity.com Nursery Handicap","2yo","Irish",,"7f ","6106","Heavy","11","9th","2","Amerigo Vespucci (IRE)","6","OCallaghan, M D","2","Roche, L F","0","120","14",,"52","1 mins 37.26s","97.26","7.300000000000001","61","7","9","Flat","0","0","3","0","1540","0","Handicap Nursery","slowly away and in rear, pushed along and some headway on outer approaching straight, 7th and ridden 1f out, no extra inside final 150 yards","10","None","Right Handed","Hood TT","26","4","Invincible Spirit (IRE)","Undulating",,"Colt","American Frolic (USA)","Blame (USA)","71",
"2023-10-30","13:40:00","Galway","www.swordsecurity.com Nursery Handicap","2yo","Irish",,"7f ","6106","Heavy","11","10th","1","Maria Land (IRE)","7","McConnell, John C","2","Rutledge, Siobhan","3","116","10",,"51","1 mins 37.26s","97.26","8.3","61","7","10","Flat","0","0","3","0","1540","0","Handicap Nursery","tracked leaders, 5th and pushed along halfway, lost place approaching straight, ridden and no impression towards rear over 1f out","11","None","Right Handed","Hood","13","4","Land Force (IRE)","Undulating",,"Filly","Villa Maria","Makfi","71",
"2023-10-30","13:40:00","Galway","www.swordsecurity.com Nursery Handicap","2yo","Irish",,"7f ","6106","Heavy","11","11th","11","Nika Pika (IRE)","11","Magee, Patrick","2","Kearney, J","5","134","14",,"71","1 mins 37.26s","97.26","19.299999999999997","61","7","11","Flat","0","0","3","0","1540","0","Handicap Nursery","always towards rear, never a factor, pushed along and no impression approaching straight, eased final furlong","1","None","Right Handed"," TT","46","7","Estidhkaar (IRE)","Undulating",,"Filly","Lady Alibi (IRE)","Muhtathir","71",
"2023-10-30","14:15:00","Galway","Corrib Food Products Maiden","3yo+","Irish",,"7f ","6903","Heavy","13","1st",,"Rapid City (IRE)","6","Comer, Luke","4","Hayes, C D","0","136","5",,"73","1 mins 36.29s","96.29",,"0","7","1","Flat","0","0","3","0","1540","0","Maiden","tracked leaders, 3rd halfway, 2nd 2f out, pushed along and led over 1f out, ridden and kept on well inside final furlong","2","None","Right Handed"," TT","14","4","War Command (USA)","Undulating","6903","Colt","Call Soon (IRE)","Lord Shanakill (USA)","73",
"2023-10-30","14:15:00","Galway","Corrib Food Products Maiden","3yo+","Irish",,"7f ","6903","Heavy","13","2nd","3.75","Hokusai (IRE)","1","Meade, Noel","3","Keane, C T","0","134","3.33",,"70","1 mins 36.29s","96.29","3.75","0","7","2","Flat","0","0","3","0","1540","0","Maiden","pushed along early and led, pushed along again and headed over 1f out, ridden and no impression on winner inside final furlong, kept on one pace","3","None","Right Handed","CkPc","8","7","Ravens Pass (USA)","Undulating","2301","Gelding","Maarit (IRE)","Harbour Watch (IRE)","73",
"2023-10-30","14:15:00","Galway","Corrib Food Products Maiden","3yo+","Irish",,"7f ","6903","Heavy","13","3rd","2","See Me Through (IRE)","3","OSullivan, Ross","3","Lee, W J","0","134","4.5",,"0","1 mins 36.29s","96.29","5.75","0","7","3","Flat","0","0","3","0","1540","0","Maiden","tracked leader, 2nd halfway, 3rd and pushed along 2f out, no impression over 1f out, ridden and kept on one pace inside final furlong","5","None","Right Handed",,"16","2","Starspangledbanner (AUS)","Undulating","1150","Colt","Trimurti (USA)","Harlans Holiday (USA)","73",
"2023-10-30","14:15:00","Galway","Corrib Food Products Maiden","3yo+","Irish",,"7f ","6903","Heavy","13","4th","1.25","Hotaugustnight (IRE)","7","Stack, J A","3","Sheridan, J M","0","129","2.75","(Fav)","68","1 mins 36.29s","96.29","7","0","7","4","Flat","0","0","3","0","1540","0","Maiden","tracked leaders, 5th halfway, 4th and pushed along 2f out, ridden and no impression inside final 150 yards, kept on one pace","11","None","Right Handed",,"78","6","Camelot","Undulating","575","Filly","Fastnet Mist (IRE)","Fastnet Rock (AUS)","73",
"2023-10-30","14:15:00","Galway","Corrib Food Products Maiden","3yo+","Irish",,"7f ","6903","Heavy","13","5th","3.75","Nouvel Espoir (IRE)","12","Barcoe, James M","3","Heffernan, J A","0","134","4",,"0","1 mins 36.29s","96.29","10.75","0","7","5","Flat","0","0","3","0","1540","0","Maiden","mid-division, 6th and pushed along 2f out, 5th and ridden over 1f out, no impression inside final furlong","4","None","Right Handed",,"12","2","Harry Angel (IRE)","Undulating","345","Gelding","Hope Lake (IRE)","Shamardal (USA)","73",
"2023-10-30","14:15:00","Galway","Corrib Food Products Maiden","3yo+","Irish",,"7f ","6903","Heavy","13","6th","2","Lets Believe (IRE)","11","Brabazon, Richard","5","Carroll, G F","0","131","11",,"39","1 mins 36.29s","96.29","12.75","0","7","6","Flat","0","0","3","0","1540","0","Maiden","mid-division, 7th and pushed along 2f out, ridden over 1f out and kept on one pace","7","None","Right Handed",,"34","9","Epaulette (AUS)","Undulating","230","Mare","Doubt (IRE)","Generous (IRE)","73",
"2023-10-30","14:15:00","Galway","Corrib Food Products Maiden","3yo+","Irish",,"7f ","6903","Heavy","13","7th","0.5","Reckless Quality (IRE)","5","Martin, Patrick","3","Kearney, J","5","124","40",,"0","1 mins 36.29s","96.29","13.25","0","7","7","Flat","0","0","3","0","1540","0","Maiden","tracked leaders, 4th halfway, 5th and pushed along 2f out, soon no impression and no extra from over 1f out","12","None","Right Handed"," TT","16","2","Dandy Man (IRE)","Undulating","0","Filly","Wild Affaire (IRE)","High Chaparral (IRE)","73",
"2023-10-30","14:15:00","Galway","Corrib Food Products Maiden","3yo+","Irish",,"7f ","6903","Heavy","13","8th","3","Barrogstown Girl (IRE)","2","Fahey, Jarlath P","3","Whelan, R P","0","129","100",,"0","1 mins 36.29s","96.29","16.25","0","7","8","Flat","0","0","3","0","1540","0","Maiden","towards rear, pushed along and no impression approaching straight, 9th over 1f out, kept on one pace, never a factor","8","None","Right Handed",,"37","1","Elusive Pimpernel (USA)","Undulating","0","Filly","Andalucia Lady (IRE)","Lend A Hand","73",
"2023-10-30","14:15:00","Galway","Corrib Food Products Maiden","3yo+","Irish",,"7f ","6903","Heavy","13","9th","HD","Windsor Road (IRE)","8","Keane, Gerard","3","Ryan, J J G","5","124","150",,"0","1 mins 36.29s","96.29","16.35","0","7","9","Flat","0","0","3","0","1540","0","Maiden","rear of mid-division, ridden and no impression 2f out, 8th over 1f out, no extra, never a factor","13","None","Right Handed",,"16","2","Camacho","Undulating",,"Filly","Secret Key (IRE)","Key Of Luck (USA)","73",
